{
  "$schema": "http://json-schema.org/draft-07/schema#",
  "title": "CMVP Certificate",
  "type": "object",
  "additionalProperties": false,
  "properties": {
    "$schema": {
      "type": "string"
    },
    "Certificate Number": {
      "type": "string",
      "pattern": "^[0-9]+$"
    },
    "Details": {
      "type": "object",
      "additionalProperties": false,
      "properties": {
        "Allowed Algorithms": {
          "type": "string"
        },
        "Entropy": {
          "type": "string"
        },
        "Module Name": {
          "type": "string"
        },
        "Standard": {
          "type": "string",
          "enum": [
            "FIPS 140-1",
            "FIPS 140-2",
            "FIPS 140-3"
          ]
        },
        "Status": {
          "type": "string",
          "enum": [
            "Active",
            "Historical",
            "Revoked"
          ]
        },
        "Sunset Date": {
          "type": "string"
        },
        "Historical Reason": {
          "type": "string"
        },
        "Overall Level": {
          "type": "integer",
          "enum": [
            1,
            2,
            3,
            4
          ]
        },
        "Caveat": {
          "type": "string"
        },
        "Security Level Exceptions": {
          "type": "array",
          "minItems": 1,
          "additionalItems": false,
          "items": {
            "type": "string"
          }
        },
        "Module Type": {
          "type": "string",
          "enum": [
            "Software",
            "Hardware"
          ]
        },
        "Embodiment": {
          "type": "string",
          "enum": [
            "Multi-chip embedded",
            "Multi-Chip Embedded",
            "Multi-chip standalone",
            "Single-chip",
            "Single Chip",
            "Multi-Chip Stand Alone"
          ]
        },
        "Description": {
          "type": "string"
        },
        "Tested Configuration(s)": {
          "type": "array",
          "minItems": 1,
          "additionalItems": false,
          "items": {
            "type": "string"
          }
        },
        "Approved Algorithms": {
          "type": "array",
          "minItems": 1,
          "additionalItems": false,
          "items": {
            "type": "array",
            "additionalItems": false,
            "items": [
              {
                "type": "string"
              },
              {
                "type": "string"
              },
              {
                "type": "array",
                "items": {
                  "type": "string",
                  "format": "uri"
                }
              }
            ]
          }
        },
        "Other Algorithms": {
          "type": "string"
        },
        "Software Versions": {
          "type": "string"
        },
        "Hardware Versions": {
          "type": "string"
        },
        "Firmware Versions": {
          "type": "string"
        },
        "Product URL": {
          "type": "string",
          "format": "uri"
        }
      },
      "required": [
        "Module Name",
        "Standard",
        "Status",
        "Overall Level",
        "Module Type",
        "Embodiment",
        "Description"
      ]
    },
    "Vendor": {
      "type": "object",
      "additionalProperties": false,
      "properties": {
        "Name": {
          "type": "string"
        },
        "Website": {
          "type": "string",
          "format": "uri"
        },
        "Address": {
          "type": "string"
        },
        "Contacts": {
          "type": "array",
          "minLength": 1,
          "maxLength": 2,
          "items": {
            "type": "object",
            "additionalProperties": false,
            "properties": {
              "Name": {
                "type": "string"
              },
              "Email": {
                "type": "string",
                "format": "email"
              },
              "Phone": {
                "type": "string"
              },
              "Fax": {
                "type": "string"
              }
            },
            "required": [
              "Name",
              "Email"
            ]
          }
        }
      },
      "required": [
        "Name",
        "Website",
        "Address",
        "Contacts"
      ]
    },
    "Related Files": {
      "type": "array",
      "additionalItems": false,
      "items": {
        "type": "array",
        "additionalItems": false,
        "items": [
          {
            "type": "string"
          },
          {
            "type": "string",
            "format": "uri"
          }
        ]
      }
    },
    "Validation History": {
      "type": "array",
      "minItems": 1,
      "additionalItems": false,
      "items": {
        "type": "object",
        "additionalProperties": false,
        "properties": {
          "Date": {
            "type": "string"
          },
          "Type": {
            "type": "string",
            "enum": [
              "Initial",
              "Update"
            ]
          },
          "Lab": {
            "type": "string"
          }
        },
        "required": [
          "Date",
          "Type",
          "Lab"
        ]
      }
    }
  },
  "required": [
    "Certificate Number",
    "Details",
    "Vendor",
    "Related Files",
    "Validation History"
  ]
}
