{
  "$schema": "./cmvp-certificate.schema.json",
  "Certificate Number": "4065",
  "Details": {
    "Module Name": "Thales Alenia Space cryptographic module for Microsemi RTAX FPGA",
    "Standard": "FIPS 140-2",
    "Status": "Active",
    "Sunset Date": "9/21/2026",
    "Overall Level": 1,
    "Caveat": "When installed, initialized and configured as specified in Section 12.4 of the Security Policy.",
    "Security Level Exceptions": [
      "Mitigation of Other Attacks: N/A"
    ],
    "Module Type": "Hardware",
    "Embodiment": "Multi-Chip Embedded",
    "Description": "Cryptographic module encrypt and decrypt input packets, using one of the thirty two possible keys. There are several TC/TM to check: status, number of packets correctly deciphered, number of ciphered packet, etc. There are three UART interfaces for: ground, key and housekeeping (the last one has a redundant interface).",
    "Tested Configuration(s)": [
      "N/A"
    ],
    "Approved Algorithms": [
      [
        "AES",
        "Cert. #A1721",
        [
          "https://csrc.nist.gov/projects/Cryptographic-Algorithm-Validation-Program/details?source=A&number=1721"
        ]
      ]
    ],
    "Allowed Algorithms": "N/A",
    "Hardware Versions": "RTAX2000S FPGA; 28C010T EEPROM",
    "Firmware Versions": "3.32.00; 3.32.04"
  },
  "Vendor": {
    "Name": "Thales Alenia Space",
    "Website": "http://www.thalesgroup.com/es/espana/espacio",
    "Address": "Calle Einstein, 7\nTres Cantos, Madrid 28760\nSpain",
    "Contacts": [
      {
        "Name": "Irene Potti Huerta",
        "Email": "irene.potti@thalesaleniaspace.com",
        "Phone": "+34 91 807 79 00"
      }
    ]
  },
  "Related Files": [
    [
      "Security Policy",
      "https://csrc.nist.gov/CSRC/media/projects/cryptographic-module-validation-program/documents/security-policies/140sp4065.pdf"
    ],
    [
      "Consolidated Certificate",
      "https://csrc.nist.gov/CSRC/media/projects/cryptographic-module-validation-program/documents/certificates/November%202021_011221_0923_signed.pdf"
    ]
  ],
  "Validation History": [
    {
      "Date": "11/2/2021",
      "Type": "Initial",
      "Lab": "DEKRA Testing and Certification S.A.U"
    }
  ]
}
